{
  "kind": "himr_cpu_speaker_screen_work_order",
  "schema_version": 1,
  "recording": {
    "media_id": "example-recording-replace-before-use",
    "path": "/ABSOLUTE/PATH/TO/recording.mp4",
    "sha256": "0000000000000000000000000000000000000000000000000000000000000000",
    "byte_count": 1,
    "duration_ms": 600000
  },
  "ffmpeg": {
    "path": "/ABSOLUTE/PATH/TO/ffmpeg",
    "sha256": "0000000000000000000000000000000000000000000000000000000000000000"
  },
  "models": {
    "kind": "himr_speaker_screen_models",
    "schema_version": 1,
    "silero_vad": {
      "path": "/ABSOLUTE/PRIVATE/PATH/TO/silero_vad.onnx",
      "sha256": "0000000000000000000000000000000000000000000000000000000000000000"
    },
    "ecapa_embedding": {
      "path": "/ABSOLUTE/PRIVATE/PATH/TO/embedding_model.ckpt",
      "sha256": "0000000000000000000000000000000000000000000000000000000000000000"
    }
  },
  "policy": {},
  "resources": {
    "threads": 1,
    "window_timeout_seconds": 120,
    "max_run_seconds": 3600,
    "max_windows_per_run": 512,
    "early_stop_on_positive": false
  },
  "source_verification": "metadata_witness",
  "output_root": "/ABSOLUTE/PRIVATE/PATH/separate-speaker-screen"
}
